{
  "$schema": "./recipe.schema.json",
  "id": "cobweb-cellar",
  "title": "Cobweb Cellar",
  "description": "Long narrow corridors with frequent chokepoints — ideal for spider web deployment strategy. The player decides which corridors to seal off with cobwebs to funnel enemies.",
  "biome": "cellar",
  "faction": "neutral",
  "size": { "width": 25, "height": 25 },
  "strategy": { "primary": "cobweb", "weight": 1.0 },
  "rooms": {
    "count": [4, 6],
    "minSize": [3, 3],
    "maxSize": [5, 5]
  },
  "corridors": {
    "style": "straight",
    "width": 1,
    "extraConnections": 0.4
  },
  "entities": {
    "torchDensity": 0.2,
    "breakableDensity": 0.1,
    "trapDensity": 0.03,
    "chestCount": [1, 2],
    "corpseCount": [1, 3],
    "cobwebSlots": 0,
    "enemyBudget": [3, 5]
  },
  "doors": { "entry": "north", "exit": "south" },
  "seed": null
}
