{
  "id": "sprint-cellar",
  "title": "Sprint Cellar",
  "description": "Timed fetch run through a narrow cellar maze. Find the quest item before The Seeker arrives.",
  "biome": "cellar",
  "faction": "neutral",
  "size": { "width": 25, "height": 25 },
  "strategy": { "primary": "fetch", "weight": 1.0 },
  "rooms": {
    "count": [8, 12],
    "minSize": [3, 3],
    "maxSize": [5, 5]
  },
  "corridors": {
    "style": "winding",
    "width": 1,
    "extraConnections": 0
  },
  "entities": {
    "torchDensity": 0.2,
    "breakableDensity": 0.05,
    "trapDensity": 0.02,
    "chestCount": [0, 1],
    "corpseCount": [1, 2],
    "cobwebSlots": 4,
    "enemyBudget": [1, 3],
    "decoyCount": [2, 3],
    "secondaryExit": true
  },
  "doors": {
    "entry": "auto",
    "exit": "none"
  },
  "timer": {
    "budgetMs": 75000,
    "sentinelGraceMs": 12000,
    "heroArchetype": "seeker"
  },
  "seed": null
}
